<?xml version="1.0" encoding="UTF-8" ?>
<routes xmlns="http://symfony.com/schema/routing"
    xmlns:xsi="http://www.w3.org/2001/XMLSchema-instance"
    xsi:schemaLocation="http://symfony.com/schema/routing
        http://symfony.com/schema/routing/routing-1.0.xsd">

    <route id="blog" path="/blog">
        <default key="_controller">
            <string>AcmeBlogBundle:Blog:index</string>
        </default>
        <default key="slug" xsi:nil="true" />
        <default key="published">
            <boolean>true</boolean>
        </default>
        <default key="page">
            <integer>1</integer>
        </default>
        <default key="price">
            <float>3.5</float>
        </default>
        <default key="archived">
            <boolean>false</boolean>
        </default>
        <default key="free">
            <boolean>1</boolean>
        </default>
        <default key="locked">
            <boolean>0</boolean>
        </default>
        <default key="foo" xsi:nil="true" />
        <default key="bar" xsi:nil="1" />
    </route>
</routes>
